{
  "$schema": "http://json-schema.org/draft-07/schema#",
  "$id": "https://github.com/LegendaryMediaTV/EGP-Graphai/bible-versions/bible-versions-schema.json",
  "title": "EGP Graphai • Bible Version",
  "description": "A single Bible version with metadata and per-testament overrides. Each version has its own _version.json file in its folder.",
  "$ref": "#/definitions/version",
  "definitions": {
    "version": {
      "type": "object",
      "additionalProperties": false,
      "required": ["_id", "name", "license"],
      "properties": {
        "_id": {
          "type": "string",
          "pattern": "^[A-Z0-9-]+$",
          "description": "Short identifier for the version, e.g., LXX, BYZ2018, EGP-EN."
        },
        "name": {
          "$ref": "../content-schema.json",
          "description": "Human-readable version name."
        },
        "license": {
          "type": "string",
          "description": "License identifier covering everything the version ships. An SPDX id such as 'CC0-1.0' where one fits, otherwise 'proprietary' or a 'LicenseRef-' id, optionally adding additional terms to the `copyright`."
        },
        "copyright": {
          "$ref": "../content-schema.json",
          "description": "The publisher's required copyright statement or license information."
        },
        "script": {
          "type": "string",
          "enum": ["G", "H"],
          "description": "Default script for this version (Greek or Hebrew). If unset, assume Latin."
        },
        "morphology": {
          "type": "string",
          "description": "Which scheme this version's `morph` codes are written in, as the _id of a file under lexical-maps/<language>/morphology, e.g. \"robinson\". A code alone does not say: `N-GSM` is Robinson and `N1T-GSM` is Packard. Absent where a version carries no morphology."
        },
        "abbr": {
          "type": "array",
          "items": { "$ref": "#/definitions/abbreviation" },
          "uniqueItems": true,
          "description": "Abbreviations this version’s content cites by id, such as critical-edition and manuscript sigla. Each version defines its own, and an id resolves only within its own version, since the same code can mean different things in different editions."
        },
        "testaments": {
          "type": "object",
          "additionalProperties": false,
          "properties": {
            "OT": { "$ref": "#/definitions/testament" },
            "NT": { "$ref": "#/definitions/testament" }
          },
          "description": "Optional per-testament overrides for script and morphology."
        },
        "books": {
          "type": "array",
          "items": {
            "type": "object",
            "additionalProperties": false,
            "required": ["_id", "name", "title", "order", "chapters"],
            "properties": {
              "_id": {
                "$ref": "https://github.com/LegendaryMediaTV/EGP-Graphai/bible-books/bible-books-schema.json#/definitions/book/properties/_id",
                "description": "Book identifier from bible-books.json (e.g., 'GEN')"
              },
              "name": {
                "$ref": "../content-schema.json",
                "description": "Name of the book in this version"
              },
              "title": {
                "$ref": "../content-schema.json",
                "description": "Title of the book in this version"
              },
              "chapters": {
                "type": "integer",
                "minimum": 1,
                "description": "Number of chapters in this book for this version"
              },
              "order": {
                "type": "integer",
                "minimum": 1,
                "description": "Order of the book in this version"
              }
            }
          },
          "uniqueItems": true,
          "description": "List of books included in this version with their order."
        }
      }
    },
    "abbreviation": {
      "type": "object",
      "additionalProperties": false,
      "required": ["_id", "name"],
      "properties": {
        "_id": {
          "type": "string",
          "pattern": "^[A-Z0-9-]+$",
          "description": "Identifier that an `abbr` content node points at, e.g., NA27, OM, MS-ALEPH."
        },
        "name": {
          "$ref": "../content-schema.json",
          "description": "How the abbreviation prints. Content rather than plain text, so its parts can carry marks, e.g., NA followed by a superscript 27."
        },
        "description": {
          "$ref": "../content-schema.json",
          "description": "What the abbreviation stands for. Text and markdown exports omit it. The web reader shows it on hover or in a modal."
        }
      }
    },
    "testament": {
      "type": "object",
      "additionalProperties": false,
      "properties": {
        "script": {
          "type": "string",
          "enum": ["G", "H"],
          "description": "Script override for this testament (Greek or Hebrew). If unset, assume Latin."
        },
        "morphology": {
          "type": "string",
          "description": "Morphology-scheme override for this testament, for an edition whose two halves are tagged in different schemes."
        }
      }
    }
  }
}
