{
  "_id": "WEBUS2020",
  "name": "World English Bible Classic",
  "copyright": "Scripture quotations are taken from The World English Bible™ of eBible.org, 2020 stable text edition. It is in the public domain.",
  "license": "CC0-1.0",
  "books": [
    {
      "_id": "GEN",
      "name": "Genesis",
      "title": "The First Book of Moses, Commonly Called Genesis",
      "order": 1,
      "chapters": 50
    },
    {
      "_id": "EXO",
      "name": "Exodus",
      "title": "The Second Book of Moses, Commonly Called Exodus",
      "order": 2,
      "chapters": 40
    },
    {
      "_id": "LEV",
      "name": "Leviticus",
      "title": "The Third Book of Moses, Commonly Called Leviticus",
      "order": 3,
      "chapters": 27
    },
    {
      "_id": "NUM",
      "name": "Numbers",
      "title": "The Fourth Book of Moses, Commonly Called Numbers",
      "order": 4,
      "chapters": 36
    },
    {
      "_id": "DEU",
      "name": "Deuteronomy",
      "title": "The Fifth Book of Moses, Commonly Called Deuteronomy",
      "order": 5,
      "chapters": 34
    },
    {
      "_id": "JSH",
      "name": "Joshua",
      "title": "The Book of Joshua",
      "order": 6,
      "chapters": 24
    },
    {
      "_id": "JDG",
      "name": "Judges",
      "title": "The Book of Judges",
      "order": 7,
      "chapters": 21
    },
    {
      "_id": "RTH",
      "name": "Ruth",
      "title": "The Book of Ruth",
      "order": 8,
      "chapters": 4
    },
    {
      "_id": "1SM",
      "name": "1 Samuel",
      "title": "The First Book of Samuel",
      "order": 9,
      "chapters": 31
    },
    {
      "_id": "2SM",
      "name": "2 Samuel",
      "title": "The Second Book of Samuel",
      "order": 10,
      "chapters": 24
    },
    {
      "_id": "1KG",
      "name": "1 Kings",
      "title": "The First Book of Kings",
      "order": 11,
      "chapters": 22
    },
    {
      "_id": "2KG",
      "name": "2 Kings",
      "title": "The Second Book of Kings",
      "order": 12,
      "chapters": 25
    },
    {
      "_id": "1CH",
      "name": "1 Chronicles",
      "title": "The First Book of Chronicles",
      "order": 13,
      "chapters": 29
    },
    {
      "_id": "2CH",
      "name": "2 Chronicles",
      "title": "The Second Book of Chronicles",
      "order": 14,
      "chapters": 36
    },
    {
      "_id": "EZR",
      "name": "Ezra",
      "title": "The Book of Ezra",
      "order": 15,
      "chapters": 10
    },
    {
      "_id": "NEH",
      "name": "Nehemiah",
      "title": "The Book of Nehemiah",
      "order": 16,
      "chapters": 13
    },
    {
      "_id": "EST",
      "name": "Esther",
      "title": "The Book of Esther",
      "order": 17,
      "chapters": 10
    },
    {
      "_id": "JOB",
      "name": "Job",
      "title": "The Book of Job",
      "order": 18,
      "chapters": 42
    },
    {
      "_id": "PSA",
      "name": "Psalms",
      "title": "The Psalms",
      "order": 19,
      "chapters": 150
    },
    {
      "_id": "PRV",
      "name": "Proverbs",
      "title": "The Proverbs",
      "order": 20,
      "chapters": 31
    },
    {
      "_id": "ECC",
      "name": "Ecclesiastes",
      "title": "Ecclesiastes or, The Preacher",
      "order": 21,
      "chapters": 12
    },
    {
      "_id": "SOS",
      "name": "Song of Solomon",
      "title": "The Song of Solomon",
      "order": 22,
      "chapters": 8
    },
    {
      "_id": "ISA",
      "name": "Isaiah",
      "title": "The Book of the Prophet Isaiah",
      "order": 23,
      "chapters": 66
    },
    {
      "_id": "JER",
      "name": "Jeremiah",
      "title": "The Book of Jeremiah",
      "order": 24,
      "chapters": 52
    },
    {
      "_id": "LAM",
      "name": "Lamentations",
      "title": "The Lamentations of Jeremiah",
      "order": 25,
      "chapters": 5
    },
    {
      "_id": "EZK",
      "name": "Ezekiel",
      "title": "The Book of Ezekiel",
      "order": 26,
      "chapters": 48
    },
    {
      "_id": "DAN",
      "name": "Daniel",
      "title": "The Book of Daniel",
      "order": 27,
      "chapters": 12
    },
    {
      "_id": "HOS",
      "name": "Hosea",
      "title": "The Book of Hosea",
      "order": 28,
      "chapters": 14
    },
    {
      "_id": "JOL",
      "name": "Joel",
      "title": "The Book of Joel",
      "order": 29,
      "chapters": 3
    },
    {
      "_id": "AMS",
      "name": "Amos",
      "title": "The Book of Amos",
      "order": 30,
      "chapters": 9
    },
    {
      "_id": "OBD",
      "name": "Obadiah",
      "title": "The Book of Obadiah",
      "order": 31,
      "chapters": 1
    },
    {
      "_id": "JNA",
      "name": "Jonah",
      "title": "The Book of Jonah",
      "order": 32,
      "chapters": 4
    },
    {
      "_id": "MIC",
      "name": "Micah",
      "title": "The Book of Micah",
      "order": 33,
      "chapters": 7
    },
    {
      "_id": "NAH",
      "name": "Nahum",
      "title": "The Book of Nahum",
      "order": 34,
      "chapters": 3
    },
    {
      "_id": "HAB",
      "name": "Habakkuk",
      "title": "The Book of Habakkuk",
      "order": 35,
      "chapters": 3
    },
    {
      "_id": "ZPH",
      "name": "Zephaniah",
      "title": "The Book of Zephaniah",
      "order": 36,
      "chapters": 3
    },
    {
      "_id": "HAG",
      "name": "Haggai",
      "title": "The Book of Haggai",
      "order": 37,
      "chapters": 2
    },
    {
      "_id": "ZEC",
      "name": "Zechariah",
      "title": "The Book of Zechariah",
      "order": 38,
      "chapters": 14
    },
    {
      "_id": "MAL",
      "name": "Malachi",
      "title": "The Book of Malachi",
      "order": 39,
      "chapters": 4
    },
    {
      "_id": "TOB",
      "name": "Tobit",
      "title": "Tobit",
      "order": 40,
      "chapters": 14
    },
    {
      "_id": "JDT",
      "name": "Judith",
      "title": "Judith",
      "order": 41,
      "chapters": 16
    },
    {
      "_id": "ESG",
      "name": "Esther (Greek)",
      "title": "Esther (Greek)",
      "order": 42,
      "chapters": 10
    },
    {
      "_id": "DAG",
      "name": "Daniel (Greek)",
      "title": "The Book of Daniel with Greek Portions",
      "order": 43,
      "chapters": 14
    },
    {
      "_id": "WIS",
      "name": "Wisdom of Solomon",
      "title": "The Wisdom of Solomon",
      "order": 44,
      "chapters": 19
    },
    {
      "_id": "SIR",
      "name": "Sirach",
      "title": "The Wisdom of Jesus the Son of Sirach, or Ecclesiasticus",
      "order": 45,
      "chapters": 51
    },
    {
      "_id": "BAR",
      "name": "Baruch",
      "title": "Baruch",
      "order": 46,
      "chapters": 6
    },
    {
      "_id": "1MC",
      "name": "1 Maccabees",
      "title": "The First Book of the Maccabees",
      "order": 47,
      "chapters": 16
    },
    {
      "_id": "2MC",
      "name": "2 Maccabees",
      "title": "The Second Book of the Maccabees",
      "order": 48,
      "chapters": 15
    },
    {
      "_id": "1ES",
      "name": "1 Esdras",
      "title": "The First Book of Esdras",
      "order": 49,
      "chapters": 9
    },
    {
      "_id": "PMA",
      "name": "Prayer of Manasses",
      "title": "The Prayer of Manasses King of Judah When He Was Held Captive in Babylon",
      "order": 50,
      "chapters": 1
    },
    {
      "_id": "PS2",
      "name": "Psalm 151",
      "title": "Psalm 151",
      "order": 51,
      "chapters": 1
    },
    {
      "_id": "3MC",
      "name": "3 Maccabees",
      "title": "The Third Book of the Maccabees",
      "order": 52,
      "chapters": 7
    },
    {
      "_id": "2ES",
      "name": "2 Esdras",
      "title": "The Second Book of Esdras",
      "order": 53,
      "chapters": 16
    },
    {
      "_id": "4MC",
      "name": "4 Maccabees",
      "title": "The Fourth Book of the Maccabees",
      "order": 54,
      "chapters": 18
    },
    {
      "_id": "MAT",
      "name": "Matthew",
      "title": "The Good News According to Matthew",
      "order": 55,
      "chapters": 28
    },
    {
      "_id": "MRK",
      "name": "Mark",
      "title": "The Good News According to Mark",
      "order": 56,
      "chapters": 16
    },
    {
      "_id": "LUK",
      "name": "Luke",
      "title": "The Good News According to Luke",
      "order": 57,
      "chapters": 24
    },
    {
      "_id": "JHN",
      "name": "John",
      "title": "The Good News According to John",
      "order": 58,
      "chapters": 21
    },
    {
      "_id": "ACT",
      "name": "Acts",
      "title": "The Acts of the Apostles",
      "order": 59,
      "chapters": 28
    },
    {
      "_id": "ROM",
      "name": "Romans",
      "title": "Paul’s Letter to the Romans",
      "order": 60,
      "chapters": 16
    },
    {
      "_id": "1CO",
      "name": "1 Corinthians",
      "title": "Paul’s First Letter to the Corinthians",
      "order": 61,
      "chapters": 16
    },
    {
      "_id": "2CO",
      "name": "2 Corinthians",
      "title": "Paul’s Second Letter to the Corinthians",
      "order": 62,
      "chapters": 13
    },
    {
      "_id": "GAL",
      "name": "Galatians",
      "title": "Paul’s Letter to the Galatians",
      "order": 63,
      "chapters": 6
    },
    {
      "_id": "EPH",
      "name": "Ephesians",
      "title": "Paul’s Letter to the Ephesians",
      "order": 64,
      "chapters": 6
    },
    {
      "_id": "PHP",
      "name": "Philippians",
      "title": "Paul’s Letter to the Philippians",
      "order": 65,
      "chapters": 4
    },
    {
      "_id": "COL",
      "name": "Colossians",
      "title": "Paul’s Letter to the Colossians",
      "order": 66,
      "chapters": 4
    },
    {
      "_id": "1TH",
      "name": "1 Thessalonians",
      "title": "Paul’s First Letter to the Thessalonians",
      "order": 67,
      "chapters": 5
    },
    {
      "_id": "2TH",
      "name": "2 Thessalonians",